{
  "$schema": "../../../profiles/neo-csharp-profile.schema.json",
  "schemaVersion": 1,
  "profileVersion": "3.10.1",
  "devpackVersion": "3.10.1",
  "capabilities": {
    "syntax.expression-bodied-member": {
      "kind": "syntax",
      "state": "supported",
      "summary": "Expression-bodied members preserve their documented C# behavior.",
      "match": {
        "syntaxKinds": [
          "ArrowExpressionClause"
        ]
      },
      "implementation": [
        "src/Neo.Compiler.CSharp/MethodConvert"
      ],
      "since": "3.10.0",
      "evidence": [
        {
          "kind": "analyzer-positive",
          "reference": "tests/Neo.SmartContract.Analyzer.UnitTests/UnsupportedSyntaxAnalyzerUnitTests.cs#ExpressionBodiedDefaultInterfaceMethod_IsAllowed"
        },
        {
          "kind": "compiler",
          "reference": "tests/Neo.Compiler.CSharp.UnitTests/UnitTest_DefaultInterfaceImplementation.cs#Contract_Uses_ExpressionBodied_Interface_Default_Implementation"
        },
        {
          "kind": "runtime",
          "reference": "tests/Neo.Compiler.CSharp.UnitTests/UnitTest_DefaultInterfaceImplementation.cs#Contract_Uses_ExpressionBodied_Interface_Default_Implementation"
        }
      ]
    },
    "type.system-single": {
      "kind": "type",
      "state": "unsupported",
      "summary": "Neo contracts do not support System.Single values.",
      "match": {
        "metadataNames": [
          "System.Single"
        ]
      },
      "diagnostic": {
        "id": "NC4002",
        "severity": "Error",
        "guidance": "Use integer or BigInteger fixed-point arithmetic with an explicit scale.",
        "helpLink": "docs/diagnostics/NC4002.md"
      },
      "since": "3.9.1",
      "evidence": [
        {
          "kind": "analyzer-negative",
          "reference": "tests/Neo.SmartContract.Analyzer.UnitTests/FloatUsageAnalyzerUnitTest.cs#FloatUsageAnalyzer_MethodSignature_ShouldReportDiagnostic"
        },
        {
          "kind": "compiler",
          "reference": "tests/Neo.Compiler.CSharp.UnitTests/SyntaxProbes/SyntaxTests.cs#Syntax_Feature_Probe"
        }
      ]
    },
    "syntax.range-byte-string": {
      "kind": "syntax",
      "state": "partially-supported",
      "summary": "Range expressions are supported only for documented byte-string receivers.",
      "match": {
        "syntaxKinds": [
          "RangeExpression"
        ]
      },
      "contexts": {
        "allowed": [
          "receiver is byte[] or string"
        ],
        "excluded": [
          "all other receiver types"
        ]
      },
      "implementation": [
        "src/Neo.Compiler.CSharp/MethodConvert/Expression/ElementExpression.cs"
      ],
      "diagnostic": {
        "id": "NC2010",
        "severity": "Error",
        "guidance": "Use ranges only with a supported byte-string receiver.",
        "helpLink": "docs/diagnostics/NC2010.md"
      },
      "since": "3.10.0",
      "evidence": [
        {
          "kind": "analyzer-positive",
          "reference": "tests/Neo.SmartContract.Analyzer.UnitTests/ArrayRangeUsageAnalyzerUnitTests.cs#ByteArrayAndStringRanges_ShouldNotReportDiagnostic"
        },
        {
          "kind": "analyzer-negative",
          "reference": "tests/Neo.SmartContract.Analyzer.UnitTests/ArrayRangeUsageAnalyzerUnitTests.cs#GeneralArrayRange_ShouldReportDiagnostic"
        },
        {
          "kind": "compiler",
          "reference": "tests/Neo.Compiler.CSharp.UnitTests/UnitTest_ArrayRangeDiagnostic.cs#GeneralArrayRange_ShouldReportTheProfileDiagnostic"
        },
        {
          "kind": "runtime",
          "reference": "tests/Neo.Compiler.CSharp.UnitTests/UnitTest_IndexOrRange.cs#Test_Main"
        }
      ]
    },
    "semantic.bool-try-parse": {
      "kind": "semantic-difference",
      "state": "supported-with-different-semantics",
      "summary": "bool.TryParse accepts additional Neo contract literals.",
      "match": {
        "memberSignatures": [
          "System.Boolean.TryParse(System.String,System.Boolean@)"
        ]
      },
      "implementation": [
        "src/Neo.Compiler.CSharp/MethodConvert/System/SystemCall.Out.cs"
      ],
      "semanticDifference": {
        "summary": "Neo accepts additional true and false literals.",
        "rationale": "The behavior is retained for contract compatibility.",
        "documentation": "docs/csharp-syntax/SemanticDifferences.md#booltryparse"
      },
      "since": "3.10.0",
      "evidence": [
        {
          "kind": "analyzer-positive",
          "reference": "tests/Neo.SmartContract.Analyzer.UnitTests/SupportedBooleanApiTests.cs#BoolTryParseIsAcceptedByTheAnalyzerSuite"
        },
        {
          "kind": "compiler",
          "reference": "tests/Neo.Compiler.CSharp.UnitTests/UnitTest_SystemCall_Out.cs#TestBoolTryParse_DotNetStyleLiterals"
        },
        {
          "kind": "runtime",
          "reference": "tests/Neo.Compiler.CSharp.UnitTests/UnitTest_SystemCall_Out.cs#TestBoolTryParse_ExtendedNeoVmLiterals"
        },
        {
          "kind": "differential",
          "reference": "tests/Neo.Compiler.CSharp.UnitTests/UnitTest_SystemCall_Out.cs#TestBoolTryParse_DiffersFromDotNetForExtendedLiterals"
        }
      ]
    }
  }
}
